<?xml version="1.0" encoding="UTF-8"?>
<xs:schema xmlns:xs="http://www.w3.org/2001/XMLSchema">

  
    <xs:element name="orders">
        <xs:complexType>
            <xs:sequence>
                <xs:element name="order" maxOccurs="unbounded">
                    <xs:complexType>
                        <xs:sequence>
                            <xs:element name="product" maxOccurs="unbounded">
                                <xs:complexType>
                                    <xs:sequence>
                                        <xs:element name="name" type="xs:string"/>
                                        <xs:element name="quantity" type="xs:positiveInteger"/>
                                    </xs:sequence>
                                    <xs:attribute name="id" type="xs:string" use="required"/>
                                </xs:complexType>
                            </xs:element>
                        </xs:sequence>
                        <xs:attribute name="id" type="xs:string" use="required"/>
                    </xs:complexType>

                   
                    <xs:unique name="UniqueProductInOrder">
                        <xs:selector xpath="product"/>
                        <xs:field xpath="@id"/>
                    </xs:unique>

                </xs:element>
            </xs:sequence>
        </xs:complexType>


        <xs:unique name="UniqueOrderID">
            <xs:selector xpath="order"/>
            <xs:field xpath="@id"/>
        </xs:unique>

    </xs:element>
</xs:schema>
