<?xml version="1.0" encoding="UTF-8"?>
<orders xmlns:xsi="http://www.w3.org/2001/XMLSchema-instance"
        xsi:noNamespaceSchemaLocation="orders.xsd">

    <order id="O001">
        <product id="P001">
            <name>Điện thoại iPhone 15</name>
            <quantity>2</quantity>
        </product>
        <product id="P002">
            <name>Laptop Dell XPS 13</name>
            <quantity>1</quantity>
        </product>
    </order>

    <order id="O002">
        <product id="P003">
            <name>Tai nghe Sony WH-1000XM5</name>
            <quantity>3</quantity>
        </product>
        <product id="P004">
            <name>Máy ảnh Canon EOS R10</name>
            <quantity>1</quantity>
        </product>
    </order>

</orders>
